{
  "$schema": "../../schemas/case/vector.v1.schema.json",
  "case_version": 1,
  "case_id": "gateway.invocation.duplex.realtime_audio",
  "description": "A realtime audio session is delivered bidirectionally locally and crosses the Kernel boundary as one finalized LLM result.",
  "protocol": {
    "name": "gateway_invocation",
    "version": 2,
    "profile": "kernel_llm"
  },
  "input": {
    "kind": "llm",
    "schema_version": 2,
    "operation_id": "op-realtime-1",
    "base_model": "model.realtime",
    "operation": "realtime",
    "modality": "audio",
    "mode": "duplex",
    "input": {
      "kind": "realtime",
      "instructions": "Answer briefly.",
      "modalities": [
        "audio",
        "text"
      ]
    },
    "features": [
      "usage"
    ],
    "trace": {
      "trace_id": "trace-realtime-1",
      "session_id": "session-realtime-1",
      "generation_id": "generation-realtime-1",
      "model_call_id": "call-realtime-1"
    }
  },
  "expect": {
    "outcome": "accept",
    "value": {
      "kind": "llm_response",
      "schema_version": 2,
      "operation_id": "op-realtime-1",
      "mode": "duplex",
      "terminal": {
        "outcome": "succeeded",
        "result": {
          "kind": "generate",
          "text": "Ready."
        }
      },
      "observation": {
        "schema_version": 2,
        "operation_id": "op-realtime-1",
        "operation": "realtime",
        "modality": "audio",
        "mode": "duplex",
        "correlation": {
          "trace_id": "trace-realtime-1",
          "session_id": "session-realtime-1",
          "generation_id": "generation-realtime-1",
          "model_call_id": "call-realtime-1"
        },
        "model": {
          "requested_base_model": "model.realtime",
          "service_kind": "fixture",
          "protocol_id": "openai.realtime.v1"
        },
        "input": {
          "kind": "realtime",
          "instructions": "Answer briefly.",
          "modalities": [
            "audio",
            "text"
          ]
        },
        "finish": {
          "reasons": [
            "stop"
          ]
        },
        "usage": {
          "availability": "reported",
          "input_audio_tokens": 4,
          "output_audio_tokens": 6,
          "total_tokens": 10
        },
        "service_reported_cost": {
          "currency": "USD",
          "amount": "0.000020"
        },
        "timing": {
          "latency_ms": 240,
          "streamed": true,
          "chunk_count": 5,
          "input_event_count": 3,
          "output_event_count": 5,
          "time_to_first_byte_ms": 8.5
        },
        "cache": {
          "prompt": {
            "state": "not_requested"
          },
          "result": {
            "state": "bypassed"
          }
        },
        "attempts": []
      },
      "receipt": {
        "receipt_id": "receipt-realtime-1",
        "operation_id": "op-realtime-1",
        "revision": 1
      }
    }
  }
}
