{
  "$schema": "../../schemas/case/vector.v1.schema.json",
  "case_version": 1,
  "case_id": "gateway.invocation.unary.text",
  "description": "A text generation call returns one finalized result and the facts needed for a Kernel generation observation.",
  "protocol": {
    "name": "gateway_invocation",
    "version": 2,
    "profile": "kernel_llm"
  },
  "input": {
    "kind": "llm",
    "schema_version": 2,
    "operation_id": "op-text-1",
    "base_model": "model.text",
    "operation": "generate",
    "modality": "text",
    "mode": "unary",
    "input": {
      "kind": "generate",
      "messages": [
        {
          "role": "user",
          "content": [
            {
              "type": "text",
              "text": "Say hello."
            }
          ]
        }
      ]
    },
    "features": [
      "usage"
    ],
    "trace": {
      "trace_id": "trace-text-1",
      "generation_id": "generation-text-1",
      "model_call_id": "call-text-1"
    }
  },
  "expect": {
    "outcome": "accept",
    "value": {
      "schema_version": 2,
      "operation_id": "op-text-1",
      "mode": "unary",
      "kind": "llm_response",
      "terminal": {
        "outcome": "succeeded",
        "result": {
          "kind": "generate",
          "text": "Hello."
        }
      },
      "observation": {
        "schema_version": 2,
        "operation_id": "op-text-1",
        "operation": "generate",
        "modality": "text",
        "mode": "unary",
        "correlation": {
          "trace_id": "trace-text-1",
          "generation_id": "generation-text-1",
          "model_call_id": "call-text-1"
        },
        "model": {
          "requested_base_model": "model.text",
          "service_kind": "fixture",
          "protocol_id": "openai.chat_completions.v1"
        },
        "input": {
          "kind": "generate",
          "messages": [
            {
              "role": "user",
              "content": [
                {
                  "type": "text",
                  "text": "Say hello."
                }
              ]
            }
          ]
        },
        "finish": {
          "reasons": [
            "stop"
          ]
        },
        "usage": {
          "availability": "reported",
          "input_tokens": 2,
          "output_tokens": 2,
          "total_tokens": 4
        },
        "service_reported_cost": {
          "currency": "USD",
          "amount": "0.000001"
        },
        "timing": {
          "latency_ms": 12.5,
          "streamed": false,
          "chunk_count": 0
        },
        "cache": {
          "prompt": {
            "state": "not_requested"
          },
          "result": {
            "state": "not_requested"
          }
        },
        "attempts": [
          {
            "attempt_id": "attempt-text-1",
            "ordinal": 1,
            "resume_generation": 0,
            "state": "succeeded",
            "base_model": "model.text",
            "service_kind": "fixture",
            "latency_ms": 12.5,
            "usage": {
              "availability": "reported",
              "input_tokens": 2,
              "output_tokens": 2,
              "total_tokens": 4
            },
            "service_reported_cost": {
              "currency": "USD",
              "amount": "0.000001"
            },
            "selected": true
          }
        ]
      },
      "receipt": {
        "receipt_id": "receipt-text-1",
        "operation_id": "op-text-1",
        "revision": 1
      }
    }
  }
}
